handle,displayName,followedByCount,orcid_to_verify,academicScore,bio
lmesseri.bsky.social,"Lisa Messeri",6,,1,"anthropologist of sci & tech. Prof @Yale. author of ""Placing Outer Space"" and VR book ""In the Land of the Unreal"". tech criticism with good vibes."
lnakamura.bsky.social,"Lisa Nakamura",6,,1,"Researcher and teacher. Writing about race, gender and internet stuff since 1995. “The Inattention Economy: How Women of Color Built the Internet” forthcoming from U. Minn press in 2026. Lisanakamura."
molly.wiki,"Molly White",6,,1,"independent writer of citationneeded.news and @web3isgoinggreat.com • tech researcher and cryptocurrency industry critic • software engineer • wikipedian  support my work: citationneeded.news/signup l"
jennhu.bsky.social,"Jennifer Hu",6,,1,"Asst Prof at Johns Hopkins Cognitive Science • Director of the Group for Language and Intelligence (GLINT) ✨• Interested in all things language, cognition, and AI  jennhu.github.io"
justinhendrix.bsky.social,"Justin Hendrix",6,,1,"Concerned with tech, media and democracy. CEO & Editor at Tech Policy Press. Research & Adjunct Professor at NYU Tandon School of Engineering. Opinions mine."
gordpennycook.bsky.social,"Gordon Pennycook",5,,3,"Associate Professor, Psychology @cornelluniversity.bsky.social. Researching thinking & reasoning, misinformation, social media, AI, belief, metacognition, B.S., and various other keywords. 🇨🇦  https"
yang3kc.bsky.social,"Kevin Yang",5,,3,"Kaicheng Yang, PhD | Assistant professor @Binghamton University CS | Computational social science, bots, +  | views mine"
przemyslslaw.bsky.social,"Przemek Grabowicz 🇵🇱🇪🇸🇩🇪🇺🇸🇮🇪",5,,3,"CS faculty at University College Dublin and the University of Massachusetts Amherst: responsible AI, social media, news media, computational social science, applied NLP, open-world AI RT≠endorsement, "
alicetiara.bsky.social,"alice e marwick",6,,1,"Dir of Research, Data & Society.  Academic. Studies tech & society, far-right disinfo. UNC CITAP. Loves pop cult. Mom, fashion victim, sci fi/fantasy enthusiast. Author of The Private is Political, St"
klonick.bsky.social,"Kate Klonick",6,,1,"Law professor & journalist looking at tech geopolitics, free expression, internet law, online governance, & AI.  Senior Editor at Lawfare.  https://klonick.substack.com/  www.kateklonick.com"
barrydevereux.bsky.social,"Barry Devereux",5,,3,"Senior Lecturer (Associate Professor) in Natural Language Processing, Queen's University Belfast. NLProc • Cognitive Science • Semantics • Health Analytics."
micahbateman.bsky.social,"Micah Bateman",6,,1,"Asst Prof in LIS. DH, CHI, libraries/archives, digital heritage, poetry. Finishing Lyric Publics: The Uses of Poetry in American Social-Media Campaigns. Opinions do not reflect employer. bit.ly/MicahB"
olivia.science,"Olivia Guest · Ολίβια Γκεστ",6,,1,"https://olivia.science  assistant professor of computational cognitive science · she/they · cypriot/kıbrıslı/κυπραία · σὺν Ἀθηνᾷ καὶ χεῖρα κίνει"
schancellor.bsky.social,"Stevie Chancellor",6,,1,"Assistant prof at UMN CS. Human-centered AI, online communities, risky mental health behaviors. Mom, lifter, nerd, haver of opinions. "
myrthereuver.bsky.social,"Myrthe Reuver",6,,1,"PhD #NLProc from CLTL, Vrije Universiteit Amsterdam || Interests: Computational Argumentation, Responsible AI, interdisciplinarity, cats || I express my own views"
zeerak.bsky.social,"Zeerak Talat زیرک طلعت (they/them)",6,,1,"Thinking about content moderation, equity, machine learning, and natural language processing.  Now: Chancellor's Fellow (~Asst. Prof) @technomoralfutures.bsky.social @edinburgh-uni.bsky.social Past: M"
mattseybold.bsky.social,"Matt Seybold",5,,3,"American Vandal Pod | Prof of AmLit & Twain Studies + Director of Media Studies, Elmira College | Resident Scholar @MarkTwain.bsky.social | Political Economy of Mass Media  TheAmericanVandal.substack."
annaleen.bsky.social,"Annalee Newitz",6,,1,"bestselling author * Hugo winner * nerd latest books: Automatic Noodle, Stories Are Weapons bylines: New Scientist, Flaming Hydra, etc. pod: www.ouropinionsarecorrect.com pronouns: they/them all the s"
eve.gd,"Martin Paul Eve",6,,1,"Tech Lead @ Knowledge Commons/MSU | Lit and Publishing Research Prof @ Uni of London, Birkbeck |  Music on tici taci records | My books: https://books.eve.gd"
soashworth.bsky.social,"Scott Ashworth",5,,3,"Professor at the University of Chicago. Philosophy, Politics, and Economics, in proportions tbd. He/Him. "
haphazardsoc.bsky.social,"Neal Caren",6,,1,"AOL Keyword: Carolina Sociology  [Coding Snippets](https://nealcaren.github.io/notes/) [Website](http://nealcaren.org)"
srhm.ca,"Sil Hamilton",6,,1,"PhD student at Cornell into cultural analytics and NLP / talks @cs50, @ComputerHistory / https://srhm.ca/"
fintanmallory.com,"Fintan Mallory",6,,1,"Philosopher at Durham University fintanmallory.com"
jbarre.bsky.social,"Jean Barré",6,,1,"PhD student @ École Normale Supérieure in Paris. Working in the Computational Literary Studies field on literary evolution of novel subgenres & canonization process + fr-BookNLP implementation w/ @lab"
julianeugarten.bsky.social,"Julia Neugarten",5,,3,"Researcher of fandom studies, fanfiction, computational literary studies and literary reception. Currently a PhD candidate at Radboud University. Views are my own."
complingy.bsky.social,"Nathan Schneider",6,,1,"Computational Linguist and Professional Nerd at Georgetown University  he/him pronouns, ALL the prepositions. http://nathan.cl"
viegas.bsky.social,"Fernanda Viégas",6,,1,"Human/AI Interaction and data visualization. Professor at Harvard. Co-founder of Google's People+AI Research initiative (PAIR)"
zittrain.bsky.social,"Jonathan Zittrain",6,,1,"A small creature who likes to run around in universities.  Prof. Harvard Law School, Harvard School of Engineering and Applied Sciences, and Harvard Kennedy School. EFF Board. Director of the Berkman "
andreawwenyi.bsky.social,"andrea wang",6,,1,"phd @ cornell infosci  https://andreawwenyi.github.io"
karenlevy.bsky.social,"Karen Levy",6,,1,"Law/tech, surveillance, work, truckers. Faculty Cornell Information Science, Cornell Law / Fellow @NewAmerica / Data Driven: http://tinyurl.com/57v559mv / www.karen-levy.net"
nolauren.bsky.social,"Lauren Tilton",6,,1,"DH Prof @URichmond. Exploring computer vision and visual culture. Ideas for the Association for Computers & the Humanities @ach.bsky.social and Computational Humanities Research Journal? Please share!"
christofs.bsky.social,"Christof Schöch",6,,1,"Doing Digital Humanities at Trier University, Germany.   Follow me on Mastodon! https://fedihum.org/@christof  Or follow my bridge account right here on Bluesky: @christof.fedihum.org.ap.brid.gy‬   Th"
gyauney.bsky.social,"Gregory Yauney",5,,3,"Postdoc in the DILL lab at USC. Cornell CS PhD. gyauney.github.io"
eytan.adar.prof,"Eytan Adar",6,,1,"Michigan faculty, http://www.cond.org"
zoeleblanc.bsky.social,"Zoe LeBlanc",6,,1,"Assistant Prof @iSchool UIUC studying digital humanities and histories of information. Interested in how we study the past with computers. she/her"
vierth.bsky.social,"Paul Vierthaler",5,,3,"Chinese Lit, DH, Machine Learning, Dad of twins  Assistant Prof of late imperial Chinese literature and interdisciplinary data science at Princeton University "
elglassman.bsky.social,"Elena Glassman",6,,1,"Assistant Professor @ Harvard SEAS specializing in human-computer and human-AI interaction. Also interested in visualization, digital humanities, urban design."
ibogost.com,"Ian Bogost",6,,1,"PREORDER The Small Stuff: How to Lead a More Gratifying Life: http://bit.ly/49gyZmp  Barbara and David Thomas Distinguished Professor at WashU; Contributing writer at The Atlantic; author of 11 books."
emmapierson.bsky.social,"Emma Pierson",5,,3,"Assistant professor of CS at UC Berkeley, core faculty in Computational Precision Health. Developing ML methods to study health and inequality. ""On the whole, though, I take the side of amazement.""  h"
s010n.bsky.social,"Solon Barocas",5,,3,"Researcher, Microsoft Research; Faculty, Information Science, Cornell University"
morganklauss.bsky.social,"Morgan Klaus Scheuerman",5,,3,"HCI research scientist @ Sony AI in Barcelona. ethical AI, identity, technological harm. Previous: CU Boulder, UMBC, Microsoft Research Fellow. posts my own. https://www.morgan-klaus.com/"
ginasue.bsky.social,"Gina Neff",5,,3,"Flower fan and AI expert. Professor of Responsible AI, QMUL;  Director Minderoo Centre for Technology and Democracy, Cambridge and fellow Magdalene College. Deputy CEO Responsible AI UK. https://linkt"
cyberlyra.bsky.social,"Cyberlyra",6,,1,"Princeton Sociology Prof; ethnographer of NASA; tech policy; digitalSTS; ethics and critical technical practice; mobile Linux. Conscientious objector to personal data economy. https://janet.vertesi.co"
aoir.bsky.social,"Association of Internet Researchers (AoIR)",6,,1,"Researching the Internet is serious business. Mostly.  (We're mainly over on AoIR.social, our organisation Mastodon instance, which is open to all members.)  https://aoir.org/ https://aoir.social/@aoi"
ainowinstitute.bsky.social,"AI Now Institute",5,,3,"The AI Now Institute produces diagnosis and actionable policy research on artificial intelligence.  Find us at https://ainowinstitute.org/ "
oddletters.bsky.social,"m. r. sauter",6,,1,"politics/technology/capitalism. prof somewhere. enthusiastic guitar guy. book on why vc was a bad idea the whole time coming from UChicago Press  writing - https://oddletters.com/ stickers+noise - htt"
bengrosser.bsky.social,"Ben Grosser",5,,3,"Artist, recomposing social platforms, AI futures, and interface cultures. Known for works like Demetricator, Computers Watching Movies, and minus.social. Faculty Associate @ Berkman Klein Harvard, Pro"
tamigraph.bsky.social,"Tamara Kneese",6,,1,"Climate/AI/labor/death researcher in Oakland. Luddite  I wrote a book about how techno-solutionism fails us in this life + beyond https://yalebooks.yale.edu/book/9780300248272/death-glitch/  www.tamar"
rebeccasear.bsky.social,"Rebecca Sear",6,,1,"Director of the Centre for Culture and Evolution, Brunel University London @brunelcce.bsky.social. President of the European Human Behaviour and Evolution Association @ehbea.bsky.social  https://www.r"
leppert.me,"Greg Leppert",6,,1,"Working on AI and access to knowledge at Harvard. Executive Director of the Institutional Data Initiative; Chief Technologist of the Berkman Klein Center."
sfiscience.bsky.social,"Santa Fe Institute ",6,,1,"The premier research center for #ComplexSystems #science.  santafe.edu   linktr.ee/sfiscience"
danlarremore.bsky.social,"Dan Larremore",5,,3,"Prof | CU Boulder BioFrontiers Institute + Computer Science | Santa Fe Institute LarremoreLab.github.io"
ritaraley.bsky.social,"Rita Raley",5,,3,"Professor of English, UC Santa Barbara https://english.ucsb.edu/people/faculty/raley-rita/  // Like everyone, working on critical AI/machine learning; more unusually, focusing on GPT-2"
bartbonikowski.bsky.social,"Bart Bonikowski",5,,3,"Assoc Prof of Sociology and Politics at NYU studying nationalism, populism, and radical-right politics using surveys, experiments, and computational text analysis. Affiliate Faculty at NYU's Center fo"
kanishka.bsky.social,"Kanishka Misra 🌊",6,,1,"Assistant Professor of Linguistics, and Harrington Fellow at UT Austin. Works on computational understanding of language, concepts, and generalization.   🕸️👁️: https://kanishka.website"
drewharwell.com,"Drew Harwell",6,,0,"tech & society @washingtonpost.com stories: drewharwell.com videos: tiktok.com/@drewharwell + instagram.com/bydrewharwell"
wiair.bsky.social,"Women in AI Research - WiAIR",5,,2,"WiAIR is dedicated to celebrating the remarkable contributions of female AI researchers from around the globe. Our goal is to empower early career researchers, especially women, to pursue their passio"
techmeme.com,"Techmeme",6,,0,"Top news and commentary for technology's leaders, from all around the web.  This account shares top-level Techmeme headlines. Visit https://techmeme.com/ for full context."
shauli.bsky.social,"Shauli Ravfogel",5,,2,"Faculty fellow at NYU CDS. Previously: PhD @ BIU NLP."
shahanmemon.bsky.social,"Shahan Ali Memon",5,,2,"Researching {science of AI-mediated science, metascience #SciSci, #AI4Science, generative #AI, LLMs, agents, alignment, misinformation in science}   PhD @ UW. Visiting @ NYU & MSR Alum @ Carnegie Mell"
yoshuabengio.bsky.social,"Yoshua Bengio",5,,2,"Working towards the safe development of AI for the benefit of all at Université de Montréal, LawZero and Mila.   A.M. Turing Award Recipient and most-cited AI researcher.  https://lawzero.org/en https"
joshuajfriedman.com,"Joshua J. Friedman",6,,0,"Freelance writer and editor. Formerly of The Atlantic, Boston Review. Copy chief at Columbia Magazine."
qjurecic.bsky.social,"Quinta Jurecic",6,,0,"Writing about law and democracy at The Atlantic, previously Lawfare. Not a lawyer. It's KWIN-ta.   signal: qjurecic.32"
nicolecrust.bsky.social,"Nicole Rust",5,,2,"Mood & Memory researcher with a computational bent. https://www.nicolecrust.com. Science advocate. Prof (UPenn Psych) - on leave as a Simons Pivot Fellow. Author: Elusive Cures. https://press.princeto"
veenadubal.bsky.social,"Veena Dubal",5,,2,"Professor of Law, University of CA, Irvine School of Law • Technology & Society • Work Law • Precarity   General Counsel AAUP   Sam's sister ❤️  Personal Account, Views My Own"
andymasley.bsky.social,"Andy Masley",6,,0,"When the going gets weird the weird turn pro.  Director of Effective Altruism DC linktr.ee/andymasley"
advanced-eschatonics.com,"Thomas Wood",5,,2,"AI scientist, roboticist, farmer, and political economist. Governments structure markets. IP is theft. @phytomech.com is my alt.  https://advanced-eschatonics.com"
tilmanbayer.bsky.social,"Tilman Bayer",6,,0,"AI, data, Wikipedia, co-maintainer of @wikiresearch.bsky.social "
harsimony.bsky.social,"Sam Harsimony",6,,0,"I write about opportunities in science, space, and policy here: https://splittinginfinity.substack.com/"
scientificdiscovery.dev,"Saloni",6,,0,"Co-founder & editor, Works in Progress. Writer, Scientific Discovery. Podcaster, Hard Drugs. Advisor, Coefficient Giving. // Previously at Our World in Data.  Newsletter: https://scientificdiscovery.d"
neurostats.org,"Manjari Narayan | @Neurostats",5,,2,"AI in Bio & Health & Therapeutic Development  Bio: https://linktr.ee/mnarayan Substack: https://blog.neurostats.org Peek into my brain: notes.manjarinarayan.org  Previously @dynotx @StanfordMed  PhD@R"
eleutherai.bsky.social,"",6,,0,""
nlpnoah.bsky.social,"Noah A. Smith",5,,2,"Researcher in NLP, ML, computer music. Prof @uwcse @uwnlp & helper @allen_ai @ai2_allennlp & familiar to two cats.  Single reeds, tango, swim, run, cocktails, מאַמע־לשון, GenX. Opinions not your busin"
annaalexandrova.bsky.social,"Anna Alexandrova",5,,2,"Philosophy of science, methodology of social sciences, wellbeing/happiness studies, evidence based policy, measurement/quantification. Professor at Cambridge HPS, Fellow of @kingscollege.bsky.social h"
vwxyzjn.bsky.social,"Costa Huang",6,,0,"RL + LLM @ai2.bsky.social; main dev of https://cleanrl.dev/"
marypcbuk.bsky.social,"Mary Branscombe",6,,0,"Omnivorous technology journalist. girl with the USB earring; author of the Cassidy At Large technomysteries. Like my writing? Buy me a ☕ https://ko-fi.com/marybranscombe. she/her. Warning: contains op"
davidbau.bsky.social,"David Bau",6,,0,"Interpretable Deep Networks. http://baulab.info/ @davidbau"
neuripsconf.bsky.social,"NeurIPS Conference",6,,0,"San Diego Dec 2-7, 25 and Mexico City Nov 30-Dec 5, 25. Comments to this account are not monitored. Please send feedback to townhall@neurips.cc."
greatdismal.bsky.social,"William Gibson",6,,0,"Author of Neuromancer and, most recently, Agency (still above from “Kill Switch”, The X-Files, Season 5, Episode 11, co-written with Tom Maddox)"
elinorpd.bsky.social,"Elinor🎗️",6,,0,"MIT // researching fairness, equity, & pluralistic alignment in LLMs  previously @ MIT media lab, mila / mcgill  i like language and dogs and plants and ultimate frisbee and baking and sunsets  https:"
dimitrisp.bsky.social,"Dimitris Papailiopoulos",5,,2,"Researcher @MSFTResearch; Prof @UWMadison (on leave); learning in context; thinking about reasoning; babas of Inez Lily. https://papail.io"
mcognetta.bsky.social,"Marco",5,,2,"Language and keyboard stuff at Google + PhD student at Tokyo Institute of Technology.  I like computers and Korean and computers-and-Korean and high school CS education.  Georgia Tech → 연세대학교 → 東京工業大学"
ajyl.bsky.social,"Andrew Lee",5,,2,"Post-doc @ Harvard. PhD UMich. Spent time at FAIR and MSR. ML/NLP/Interpretability"
kevinzollman.com,"Kevin Zollman",5,,2,"Philosophy and Game Theory at Carnegie Mellon 🦚 Research the interface between philosophy, economics, and biology 💱 www.kevinzollman.com"
sherrytswu.bsky.social,"Sherry Tongshuang Wu",5,,2,"Assist. Prof at CMU, CS PhD at UW. HCI+AI, map general-purpose models to specific use cases!"
binarybits.bsky.social,"Timothy B. Lee",5,,2,"Reporting on AI and the future of the economy. Computer science masters degree from Princeton.   Subscribe to my AI newsletter: http://www.understandingai.org"
wfwhitney.bsky.social,"Will Whitney",6,,0,"RS at DeepMind. willwhitney.com"
claireasher.bsky.social,"Dr Claire Asher",6,,0,"Freelance science writer & communicator, occasional comedian & opportunistic wildlife photographer. Co-author of Brave Green World. Host of the Robot Talk Podcast (@robottalkpod.bsky.social).  She / h"
glenberseth.bsky.social,"Glen Berseth",5,,2,"Assistant Prof at @UMontreal @mila-quebec.bsky.social @MontrealRobots . CIFAR AI Chair, RL_Conference chair. Creating generalist problem-solving agents for the real world. He/him/il."
davidpicard.bsky.social,"David Picard",5,,2,"Professor of Computer Vision/Machine Learning at Imagine/LIGM, École nationale des Ponts et Chaussées @ecoledesponts.bsky.social Music & overall happiness 🌳🪻 Born well below 350ppm 😬 mostly silly p"
jonbarron.bsky.social,"Jon Barron",5,,2,"Principal research scientist at Google DeepMind. Synthesized views are my own. 📍SF Bay Area 🔗 http://jonbarron.info  This feed is a mostly-incomplete mirror of https://x.com/jon_barron, I recommend "
stonet2000.bsky.social,"Stone Tao",5,,2,"PhDing @UCSanDiego @NVIDIA @hillbot_ai on scalable robot learning and embodied AI. Co-founded @LuxAIChallenge to build AI competitions. @NSF GRFP fellow  http://stoneztao.com"
apepa.bsky.social,"Pepa Atanasova",5,,2,"Assistant Professor, University of Copenhagen; interpretability, xAI, factuality, accountability, xAI diagnostics https://apepa.github.io/"
sedielem.bsky.social,"Sander Dieleman",5,,2,"Blog: https://sander.ai/ 🐦: https://x.com/sedielem Research Scientist at Google DeepMind (WaveNet, Imagen 3, Veo, ...). I tweet about deep learning (research + software), music, generative models (pe"
jmac-ai.bsky.social,"James MacGlashan",6,,0,"Ask me about Reinforcement Learning Research @ Sony AI AI should learn from its experiences, not copy your data.  My website for answering RL questions: https://www.decisionsanddragons.com/  Views and"
irenetrampoline.bsky.social,"Irene Chen",5,,2,"ML for healthcare and health equity. Assistant Professor at UC Berkeley and UCSF.   https://irenechen.net/"
lu.is,"Luis Villa",6,,0,"Programmer-turned-lawyer, trying to build human(e) futures.  Day job: SonarSource. Boards: Creative Commons, OpenET (open water data), CA Housing Defense. Also: 415, dad. Past: Wikipedia, Moz, 305  Al"
esteng.bsky.social,"Elias Stengel-Eskin",5,,2,"Postdoc @UNC working on NLP, AI, and computational linguistics. Formerly PhD student @JHU and undergrad @McGill esteng.github.io"
marcelhussing.bsky.social,"Marcel Hussing",5,,2,"PhD student at the University of Pennsylvania. Prev, intern at MSR, and Meta FAIR. Interested in reliable and replicable reinforcement learning, robotics and knowledge discovery: https://marcelhussing"
multiplicityct.bsky.social,"Chris",5,,2,"PhD student in philosophy at the University of Staffordshire. Heidegger, analytic ethics (trust and mistrust), philosophy of tech/AI. Marylander. MA Staffs, MBA Duke. Wittgenstein and Cantor handshake"
bwyble.bsky.social,"Brad Wyble",5,,2,"Academic, cognitive & vision scientist, computational modeller, cofounder @neuromatch Academy,  He/His.  This is a personal account."
fxbriol.bsky.social,"François-Xavier Briol",5,,2,"Professor of Statistics and Machine Learning at UCL Statistical Science. Interested in computational statistics, machine learning and applications in the sciences & engineering."
diliaravaleeva.bsky.social,"Diliara Valeeva",5,,2,"Assistant Professor in Computational Social Science at the University of Amsterdam. Posts about elites, finance, and business."
littmath.bsky.social,"Daniel Litt",5,,2,"Assistant professor (of mathematics) at the University of Toronto. Algebraic geometry, number theory, forever distracted and confused, etc. He/him."
matejbalog.bsky.social,"Matej Balog",5,,2,"Research Scientist at Google DeepMind, working on algorithm discovery using AI: AlphaTensor, FunSearch, and beyond"
desjardins.bsky.social,"Guillaume Desjardins ",5,,2,"Research Scientist at Google DeepMind."
mvandepanne.bsky.social,"Michiel van de Panne",5,,2,"UBC Computer Science; physics-based models of human movement; deep reinforcement learning; animation; robotics"
hadley.nz,"Hadley Wickham",6,,0,"R, data, 🐕, 🍸, 🌈. He/him."
mxvl.bsky.social,"Max Vladymyrov",5,,2,"Research Scientist @ Google DeepMind"
kale-ab.bsky.social,"Kale-ab Tessera",5,,2,"ML PhD Student @ Uni. of Edinburgh, working on Multi-Agent Problems. | Organiser @deeplearningindaba.bsky.social‬ @rl-agents-rg.bsky.social‬ | 🇪🇹🇿🇦 kaleabtessera.com"
nparikh.org,"Neal Parikh",6,,0,"https://nparikh.org"
ftudisco.bsky.social,"Francesco Tudisco",5,,2,"Machine Learning @ University of Edinburgh | AI4Science | optimization | numerics | networks | co-founder @ MiniML.ai | ftudisco.gitlab.io"
sanmayd.bsky.social,"Sanmay Das",5,,2,"CS prof at VT Innovation Campus, Assoc. Dir., AI for Social Impact, Sanghani Center. Professional: AI and society, EconCS, etc. Chair, ACM SIGAI. Personal: Husband, dad, squash player, cyclist. From D"
statmodeling.bsky.social,"Andrew Gelman et al.",6,,0,"Automatically tweets new posts from http://statmodeling.stat.columbia.edu Please respond in the comment section of the blog. Old posts spool at https://twitter.com/StatRetro"
risi.bsky.social,"Sebastian Risi",6,,0,"Neuroevolution, Collective Intelligence, Self-organization"
flaviucipcigan.bsky.social,"Flaviu Cipcigan",6,,0,"Building AIs for scientific discovery. Discovered antibiotics and materials for carbon capture. Tango dancer. See more at flaviucipcigan.com. Opinions my own."
araffin.bsky.social,"Antonin Raffin",5,,2,"Researcher in robotics and machine learning (Reinforcement Learning). Maintainer of Stable-Baselines (SB3).  https://araffin.github.io/"
akoopa.bsky.social,"Anna Koop",5,,2,"Eternal learner, incorrigible thinker. Roaming AI researcher, maker, idea generator. Sometimes I even complete things. Eventually. Best known for infectious enthusiasm and irrepressible outbursts. My "
eringrant.me,"Erin Grant",5,,2,"Assistant Professor / Faculty Fellow @nyudatascience.bsky.social studying cognition in mind & brain with neural nets, Bayes, and other tools (eringrant.github.io).  elsewhere: sigmoid.social/@eringran"
tszzl.bsky.social,"roon",6,,0,""
rosanneliu.com,"Rosanne Liu",5,,2,"Founder & executive & community builder & organizer & researcher ML Collective (mlcollective.org) Google DeepMind rosanneliu.com"
nantas.bsky.social,"Nantas Nardelli",5,,2,"AI @ Pacific Fusion. Climate change monomaniac.  PhD @ Oxford. Prev: Carbon Re, DeepMind, FAIR, MSR, […]  🌍 / 🇪🇺 / 🇮🇹 / he / him.  Website: arbitrarygravitas.com"
sramsay2.bsky.social,"Stephen Ramsay",5,,2,"Professor of English and Fellow at the Center for Digital Research in the Humanities at the University of Nebraska-Lincoln. Mainly #DigitalHumanities. Blog at https://stephenramsay.net/"
jeffvandermeer.bsky.social,"Jeff VanderMeer",6,,0,"NYT bestselling author of the Southern Reach series, including Absolution.  Repped by Joe Veltre at Gersh. he/him"
whkchun.bsky.social,"Wendy Hui Kyong Chun",5,,2,"new media theorist and professor. director of the SFU digital democracies institute. posts reflect my own views only.   banner from Mongrel Network's 2004 Bush-Blair project. Portrait by a wonderful s"
post45data.bsky.social,"Post45 Data Collective",6,,0,"Peer-reviewed, open-access literary & cultural data (1945–present). Explore, reuse, or submit datasets: https://data.post45.org/"
altmetric.com,"Altmetric",6,,0,"We measure the attention that research outputs receive from policy documents, mainstream news outlets, Wikipedia, social media and online reference managers. We detect sentiment of Bluesky/X posts.  C"
barackobama.bsky.social,"Barack Obama",6,,0,"Dad, husband, President, citizen. barackobama.com"
rajmovva.bsky.social,"Raj Movva",5,,2,"NLP, ML & society, healthcare.  PhD student at Berkeley, previously CS at MIT.  https://rajivmovva.com/ "
mark-carney.bsky.social,"Mark Carney",6,,0,"Prime Minister of Canada and Leader of the Liberal Party | Premier ministre du Canada et chef du Parti libéral  markcarney.ca "
bcmerchant.bsky.social,"Brian Merchant",6,,0,"author of Blood in the Machine, tech writer, luddite  newsletter: https://www.bloodinthemachine.com/  books: https://www.hachettebookgroup.com/contributor/brian-merchant/  kofi link: https://ko-fi.com"
nytpitchbot.bsky.social,"NY Times Pitchbot",6,,0,"Parody. Merch: https://tinyurl.com/msjjmwpt"
