handle,displayName,followedByCount,orcid_to_verify,academicScore,bio
mmitchell.bsky.social,"Margaret Mitchell",19,,3,"Researcher trying to shape AI towards positive outcomes. ML & Ethics +birds. Generally trying to do the right thing. TIME 100 | TED speaker | Senate testimony provider | Navigating public life as a re"
markriedl.bsky.social,"Mark Riedl",19,,3,"AI for storytelling, games, explainability, safety, ethics. Professor at Georgia Tech. Associate Director of ML Center at GT. Time travel expert. Geek. Dad. he/him"
melaniemitchell.bsky.social,"Melanie Mitchell",19,,2,"Professor, Santa Fe Institute.  Research on AI, cognitive science, and complex systems.   Website: https://melaniemitchell.me  Substack: https://aiguide.substack.com/"
carlbergstrom.com,"Carl T. Bergstrom",16,,3,"Professor, UW Biology / Santa Fe Institute  I study how information flows in biology, science, and society.  Book: *Calling Bullshit*, http://tinyurl.com/fdcuvd7b  LLM course: https://thebullshitmachi"
randomwalker.bsky.social,"Arvind Narayanan",16,,3,"Princeton computer science prof. I write about the societal impact of AI, tech ethics, & social media platforms. https://www.cs.princeton.edu/~arvindn/  BOOK: AI Snake Oil. https://www.aisnakeoil.com/"
lucy3.bsky.social,"Lucy Li",16,,2,"Postdoc at UW NLP 🏔️. #NLProc, computational social science, cultural analytics, responsible AI. she/her. Previously at Berkeley, Ai2, MSR, Stanford. Incoming assistant prof at Wisconsin CS. lucy3.gi"
yoavartzi.com,"Yoav Artzi",14,,5,"LM/NLP/ML researcher  ¯\_(ツ)_/¯   yoavartzi.com / associate professor @ Cornell CS + Cornell Tech campus @ NYC / nlp.cornell.edu / associate faculty director @ arXiv.org / researcher @ ASAPP / startin"
beenwrekt.bsky.social,"Ben Recht",16,,0,"Blog: https://argmin.substack.com/ Webpage: https://people.eecs.berkeley.edu/~brecht/"
kylelo.bsky.social,"Kyle Lo",16,,0,"language model pretraining @ai2.bsky.social, co-lead of data research w/ @soldaini.net, statistics @uw, open science, tabletop, seattle, he/him,🧋 kyleclo.com"
meredithmeredith.bsky.social,"Meredith Whittaker ",15,,2,"President of Signal, Chief Advisor to AI Now Institute "
nsaphra.bsky.social,"Naomi Saphra",16,,0,"Waiting on a robot body. All opinions are universal and held by both employers and family. ML/NLP.  nsaphra.net"
karpathy.bsky.social,"karpathy",15,,1,"AI @ OpenAI, Tesla, Stanford"
haldaume3.bsky.social,"Hal Daumé III",14,,2,"Human-centered AI #HCAI, NLP & ML. Director TRAILS (Trustworthy AI in Law & Society) and AIM (AI Interdisciplinary Institute at Maryland). Formerly Microsoft Research NYC. Fun: 🧗🧑‍🍳🧘⛷️🏕️. he/him."
yoavgo.bsky.social,"Yoav Goldberg",15,,0,""
alondra.bsky.social,"Alondra Nelson",14,,2,"Scholar, author, policy advisor alondranelson.com  Science, Technology, and Social Values Lab  https://www.ias.edu/stsv-lab"
emilymbender.bsky.social,"Emily M. Bender",14,,1,"Book: https://thecon.ai  Web: https://faculty.washington.edu/ebender"
maosbot.bsky.social,"M A Osborne",13,,3,"Parent, spouse, Australian, Professor of Machine Learning in Oxford. Long Covid, trans rights, music, reggae on Fridays, AI must be good for humans, https://www.robots.ox.ac.uk/~mosb"
howard.fm,"Jeremy Howard ",14,,1,"https://Answer.AI & https://fast.ai founding CEO; previous: hon professor @ UQ; leader of masks4all; founding CEO Enlitic; founding president Kaggle; various other stuff…"
crystaljjlee.com,"Crystal Lee",14,,1,"Writing about tech, power, data visualization, social media, disability. Assistant prof of computational media @ MIT. 🇹🇼  crystaljjlee.com"
arnicas.bsky.social,"Lynn Cherny",14,,0,"Into creative ML/AI, NLP, data science and digital humanities, narrative, infovis, games, sf & f. Consultant, ds in Residence at Google Arts & Culture. (Lyon, FR) Newsletter arnicas.substack.com."
chrmanning.bsky.social,"Christopher Manning",13,,2,"Stanford Linguistics and Computer Science. Director, Stanford AI Lab. Founder of @stanfordnlp.bsky.social . #NLP https://nlp.stanford.edu/~manning/"
jacobeisenstein.bsky.social,"Jacob Eisenstein",14,,0,"natural language processing and computational linguistics at google deepmind."
davidpfau.com,"David Pfau",14,,0,"So far I have not found the science, but the numbers keep on circling me.  Views my own, unfortunately."
abeba.bsky.social,"Dr Abeba Birhane",12,,4,"Founder & PI @aial.ie. Assistant Professor of AI, School of Computer Science & Statistics, @tcddublin.bsky.social   AI accountability, AI audits & evaluation, critical data studies. Cognitive scientis"
aaronclauset.bsky.social,"Aaron Clauset",11,,6,"NO KINGS. NO FASCISTS. FUND SCIENCE.  Professor of Computer Science @ BioFrontiers Institute at University of Colorado, Boulder and External Faculty @ Santa Fe Institute  orcid: https://orcid.org/0000"
grimalkina.bsky.social,"Cat Hicks",13,,1,"Psychologist for the humans of tech. Author of The Psychology of Software Teams (2026). Founder: Catharsis Consulting (strategy * science). she/her 🏳️‍🌈 https://www.catharsisinsight.com/  Host at: h"
eryk.bsky.social,"Eryk Salvaggio",12,,3,"Situationist Cybernetics. Gates Scholar researching AI’s impacts on the Humanities at the University of Cambridge. Affiliate, Machine Visual Culture Research Group (Max Planck Institute, Rome). Aim to"
axz.bsky.social,"Amy Zhang",13,,1,"Associate professor of social computing at UW CSE, leading @socialfutureslab.bsky.social  social.cs.washington.edu"
srushnlp.bsky.social,"Sasha Rush",13,,1,"Professor, Programmer in NYC.   Cornell, Hugging Face 🤗"
sayash.bsky.social,"Sayash Kapoor",13,,1,"CS PhD candidate at Princeton. I study the societal impact of AI.  Website: cs.princeton.edu/~sayashk  Book/Substack: aisnakeoil.com"
jonathancheng.bsky.social,"Jonathan Cheng",12,,3,"English PhD turned Machine Learning Researcher. I medicate my imposter syndrome with cold brews.  Current:  Foundation Models @ Apple  Prev:  LLMs/World Models @ Riot Games RecSys @ Apple  Seattle 🏳️"
lampinen.bsky.social,"Andrew Lampinen",12,,3,"Interested in cognition and artificial intelligence. Research Scientist at Google DeepMind. Previously cognitive science at Stanford. Posts are mine. lampinen.github.io"
mjcrockett.bsky.social,"M.J. Crockett",12,,3,"Professor of Psychology & Human Values at Princeton | Cognitive scientist curious about technology, narratives, & epistemic (in)justice | They/She 🏳️‍🌈 www.crockettlab.org"
mellymeldubs.bsky.social,"Melanie Walsh",12,,3,"Assistant Professor @ University of Washington, Information School. PhD in English from WashU in St. Louis.   I’m interested in books, data, social media, & digital humanities.   They call me ""Eyre Jo"
jay.bsky.team,"Jay 🦋",13,,0,"CEO of Bluesky, steward of AT Protocol.   dec/acc 🌱 🪴 🌳"
jmendelsohn2.bsky.social,"Julia Mendelsohn",11,,4,"Asst Prof @UMD Info College. NLP, computational social science, political communication, linguistics. Past: Data Science Postdoc @UChicago, Info PhD @UMich, CS + Lx @Stanford. Interests: cats, Yiddish"
zephoria.bsky.social,"danah boyd",12,,2,"STS researcher who likes to look at things sideways. Founded Data & Society.  Topics: Census | Youth | Data | Society  Professor of Communication, Cornell  https://made-not-found-by-danah-boyd.ghost.i"
chenhaotan.bsky.social,"",12,,2,"Associate professor at the University of Chicago. Working on human-centered AI, NLP, CSS. https://chenhaot.com, https://substack.com/@cichicago"
wattenberg.bsky.social,"Martin Wattenberg",12,,2,"Human/AI interaction. ML interpretability. Visualization as design, science, art. Professor at Harvard, and part-time at Google DeepMind."
dasmiq.bsky.social,"David Smith",11,,4,"Associate professor of computer science at Northeastern University. Natural language processing, digital humanities, OCR, computational bibliography, and computational social sciences. Artificial inte"
simonwillison.net,"Simon Willison",12,,2,"Independent AI researcher, creator of datasette.io and llm.datasette.io, building open source tools for data journalism, writing about a lot of stuff at https://simonwillison.net/"
thomwolf.bsky.social,"Thomas Wolf",13,,0,"Co-founder @huggingface"
emollick.bsky.social,"Ethan Mollick",12,,2,"Professor at Wharton, studying AI and its implications for education, entrepreneurship, and work. Author of Co-Intelligence. Book: https://a.co/d/bC2kSj1 Substack: https://www.oneusefulthing.org/ Web:"
soldaini.net,"Luca Soldaini 🎀",13,,0,"I like tokens! Lead for OLMo data at @ai2.bsky.social (Dolma 🍇) w @kylelo.bsky.social. Open source is fun 🤖☕️🍕🏳️‍🌈 Opinions are sampled from my own stochastic parrot   more at https://soldaini.ne"
mm-jj-nn.bsky.social,"Mark 🎄. Nelson",11,,4,"Comp. sci. prof. @ American University, Washington DC. AI & games researcher with miscellaneous other interests. https://www.kmjn.org/"
vickiboykis.com,"Vicki",13,,0,"Founding list[float] engineer. Recsys. Personalization. Infra. Systems. Normcore code. Nutella. Vectors. Words. Vibes. Bad puns (soon). https://vickiboykis.com/what_are_embeddings/"
zacharylipton.bsky.social,"Zachary Lipton",12,,2,"Cofounder & CTO @ Abridge, Raj Reddy Associate Prof of ML @ CMU, occasional writer, relapsing 🎷, creator of d2l.ai & approximatelycorrect.com"
sashamtl.bsky.social,"Dr Sasha Luccioni",12,,2,"Climate & AI Lead @HuggingFace, TED speaker, WiML board member, TIME AI 100 (She/her/Dr/🦋)"
hf.co,"Hugging Face",12,,1,"The AI community building the future! "
annarogers.bsky.social,"Anna Rogers",11,,3,"Associate professor at IT University of Copenhagen: NLP, language models, interpretability, AI & society. Co-editor-in-chief of ACL Rolling Review. #NLProc #NLP"
laurenfklein.bsky.social,"Lauren Klein",12,,1,"Digital humanities, data science, AI, eating, professor of Data & Decision Science and English. Coauthor #DataFeminism w/ @kanarinka. PI #AIAInetwork. Views my own."
angelamczhou.bsky.social,"angela zhou",11,,3,"assistant prof at USC Data Sciences and Operations and Computer Science; phd Cornell ORIE.  data-driven decision-making, operations research/management, causal inference, algorithmic fairness/equity b"
timkellogg.me,"Tim Kellogg",12,,1,"AI Architect | North Carolina | AI/ML, IoT, science  WARNING: I talk about kids sometimes"
hannawallach.bsky.social,"Hanna Wallach",11,,3,"VP and Distinguished Scientist at Microsoft Research NYC. AI evaluation and measurement, responsible AI, computational social science, machine learning. She/her.  One photo a day since January 2018: h"
azjacobs.bsky.social,"Abigail Jacobs",12,,1,"Asst Prof of Information @ UMich thinking about assumptions built into AI"
gracekind.net,"Grace",12,,0,"A latent space odyssey  gracekind.net"
afedercooper.bsky.social,"A. Feder Cooper",10,,4,"ML researcher, Stanford postdoc affiliate, future Yale professor  https://afedercooper.info"
valentinapy.bsky.social,"Valentina Pyatkin",10,,4,"Postdoc in AI at the Allen Institute for AI & the University of Washington.  🌐 https://valentinapy.github.io"
neuralnoise.com,"Pasquale Minervini",9,,6,"Researcher in ML/NLP at the University of Edinburgh (faculty at Informatics and EdinburghNLP), Co-Founder/CTO at www.miniml.ai, ELLIS (@ELLIS.eu) Scholar, Generative AI Lab (GAIL, https://gail.ed.ac.u"
msalganik.bsky.social,"Matthew Salganik",11,,2,"Professor of Sociology, Princeton, www.princeton.edu/~mjs3 Author of Bit by Bit: Social Research in the Digital Age, bitbybitbook.com "
dallascard.bsky.social,"Dallas Card",11,,2,"Assistant professor at https://si.umich.edu/ working in computational social science, machine learning, and NLP | https://dallascard.github.io"
tdietterich.bsky.social,"Thomas Dietterich",11,,2,"Safe and robust AI/ML, computational sustainability. Former President AAAI and IMLS. Distinguished Professor Emeritus, Oregon State University. https://web.engr.oregonstate.edu/~tgd/"
chrisbrockett.bsky.social,"Chris Brockett",12,,0,"Data janitor and leftover linguist (retired). Tsundoku expert. Language & Cognition. NLP. Japanese literature. Anti-authoritarian. Pro-science. "
chrisalbon.com,"Chris Albon",12,,0,""
mmbronstein.bsky.social,"Michael Bronstein",10,,4,"DeepMind Professor of AI @Oxford Scientific Director @Aithyra Chief Scientist @VantAI ML Lead @ProjectCETI  geometric deep learning, graph neural networks, generative models, molecular design, protein"
minsuk.bsky.social,"Minsuk Chang",11,,2,"Research Scientist @ Google Deepmind. Opinions are my own.  minsukchang.com"
dieworkwear.bsky.social,"derek guy",12,,0,"Menswear writer. Editor at Put This On. Words at The New York Times, The Washington Post, The Financial Times, Esquire, and Mr. Porter.   If you have a style question, search:  https://dieworkwear.com"
kjhealy.co,"Kieran Healy",12,,0,"Social science and other distractions. Old posts get deleted pretty quick.  https://kieranhealy.org /  https://theordinalsociety.com"
xkcd.com,"Randall Munroe",12,,0,""
shannonmattern.bsky.social,"Shannon Mattern",11,,1,"director of creative research @ the metro ny library council; recently resigned 😱 full professor of media studies, art history + anthropology   architecture, archives, 🎨, cities, 🐕, infrastructure,"
gligoric.bsky.social,"Kristina Gligoric",9,,5,"Assistant Professor of Computer Science @JohnsHopkins, CS Postdoc @Stanford, PHD @EPFL, Computational Social Science, NLP, AI & Society https://kristinagligoric.com/"
danielvanstrien.bsky.social,"Daniel van Strien",11,,1,"Machine Learning Librarian at @hf.co "
jhamrick.bsky.social,"Jess Hamrick",11,,1,"Researching planning, reasoning, and RL in LLMs @ Reflection AI. Previously: Google DeepMind, UC Berkeley, MIT. I post about: AI 🤖, flowers 🌷, parenting 👶, public transit 🚆. She/her.  http://www.j"
ramon-astudillo.bsky.social,"Ramon Astudillo",10,,3,"Principal Research Scientist at IBM Research AI in New York. Speech, Formal/Natural Language Processing. Currently LLM post-training, structured SDG and RL. Opinions my own and non stationary. ramon.a"
shahabbakht.bsky.social,"Shahab Bakhtiari",8,,7,"|| assistant prof at University of Montreal || leading the systems neuroscience and AI lab (SNAIL: https://www.snailab.ca/) 🐌 || associate academic member of Mila (Quebec AI Institute) || #NeuroAI ||"
neuroai.bsky.social,"Ida Momennejad",11,,1,"Principal Researcher @ Microsoft Research.  AI, RL, cog neuro, philosophy. www.momen-nejad.org"
raphaelmilliere.com,"Raphaël Millière",11,,1,"Philosopher of Artificial Intelligence & Cognitive Science https://raphaelmilliere.com/"
roydanroy.bsky.social,"Dan Roy",10,,3,"Research Director, Founding Faculty, Canada CIFAR AI Chair @VectorInst. Full Prof @UofT - Statistics and Computer Sci. (x-appt) danroy.org  I study assumption-free prediction and decision making under"
psmaldino.bsky.social,"Paul Smaldino",10,,3,"Paradigmatically promiscuous scientist. Ankylosaur enthusiast. Modeler of cultural evolution and related topics. Professor at UC Merced and the Santa Fe Institute. Web: https://smaldino.com/wp/"
rajammanabrolu.bsky.social,"Prithviraj ""Raj"" Ammanabrolu",10,,3,"AI, RL, NLP, Games Asst Prof at UCSD Research Scientist at Nvidia Lab: http://pearls.ucsd.edu Personal: prithvirajva.com"
roxanegay.bsky.social,"Roxane Gay",11,,1,"https://linktr.ee/roxanegay  Writer, editor, publisher, professor. Some people call me a bad feminist and by some people I mean me."
cfiesler.bsky.social,"Dr. Casey Fiesler",11,,1,"information science professor (tech ethics + internet stuff) kind of a content creator (elsewhere also @professorcasey) though not influencing anyone to do anything except maybe learn things she/her m"
katestarbird.bsky.social,"Kate Starbird",10,,3,"Researcher of online rumors & disinformation. Former basketball player. Prof at University of Washington, HCDE. Co-founder of the UW Center for an Informed Public. Personal account: Views may not refl"
foucaultwelles.bsky.social,"Brooke Foucault Welles",11,,1,"Professor of Communication, trying not to be evil Ass. Dean, #HashtagActivism co-author, mom to teenagers and cats. Appreciates novelty socks and cat memes."
anamarasovic.bsky.social,"Ana Marasović",10,,2,"Asst prof @ University of Utah · NLP · she/her 🇭🇷"
caseynewton.bsky.social,"Casey Newton",11,,0,"Email salesman at Platformer.news and podcast co-host at Hard Fork. "
williamis.bsky.social,"William Isaac",10,,2,"Research Scientist @DeepMind | Previously @OSFellows & @hrdag. RT != endorsements. Opinions Mine. Pronouns: he/him  "
strubell.bsky.social,"Emma Strubell",10,,2,"assistant professor, @ltiatcmu.bsky.social. machine learning: LLMs and climate. 🏳️‍🌈🏳️‍⚧️ they/them/dad (2 dogs).  pro-AI, anti-capitalist, anti-fascist.  Website: strubell.github.io"
jeffdean.bsky.social,"Jeff Dean",10,,2,"Google Chief Scientist, Gemini Lead. Opinions stated here are my own, not those of Google.  Gemini, TensorFlow, MapReduce, Bigtable, Spanner, ML things, ..."
lasha.bsky.social,"Abhilasha Ravichander",9,,4,"Incoming faculty at the Max Planck Institute for Software Systems Postdoc at UW, working on Natural Language Processing  Recruiting PhD students!  🌐 https://lasharavichander.github.io/"
ccanonne.github.io,"Clément Canonne",9,,4,"Senior Lecturer #USydCompSci at the University of Sydney. Postdocs IBM Research and Stanford; PhD at Columbia. Converts ☕ into puns: sometimes theorems. He/him."
mjskay.com,"Matthew Kay",10,,2,"Assoc Prof Computer Science and Communication Studies at Northwestern. Infovis, HCI. Author of tidybayes & ggdist R pkgs. he/him. 🏳️‍🌈 https://mjskay.com/  Co-director https://mucollective.northwest"
romapatel.bsky.social,"Roma Patel",9,,4,"research scientist @deepmind. language & multi-agent rl & interpretability. phd @BrownUniversity '22 under ellie pavlick (she/her) https://roma-patel.github.io"
sungkim.bsky.social,"Sung Kim",11,,0,"A business analyst at heart who enjoys delving into AI, ML, data engineering, data science, data analytics, and modeling. My views are my own.  You can also find me at threads: @sung.kim.mw"
peterhenderson.bsky.social,"Peter Henderson",10,,2,"Assistant Professor the Polaris Lab @ Princeton (https://www.polarislab.org/); Researching: RL, Strategic Decision-Making+Exploration; AI+Law"
egrefen.bsky.social,"Edward Grefenstette",10,,2,"FR/US/GB AI/ML Person, Director of Research at Google DeepMind, Honorary Professor at UCL DARK, ELLIS Fellow. Ex Oxford CS, Meta AI, Cohere."
tyrellturing.bsky.social,"Blake Richards",9,,4,"Researcher at Google and CIFAR Fellow, working on the intersection of machine learning and neuroscience in Montréal (academic affiliations: @mcgill.ca and @mila-quebec.bsky.social)."
joao.omg.lol,"joao",11,,0,"Research Engineer at Google DeepMind A special snowflake existing in 196883 dimensions #ActuallyAutistic He/Him"
dileeplearning.bsky.social,"Dileep George @dileeplearning",10,,2,"AGI research @DeepMind.  Ex cofounder & CTO Vicarious AI (acqd by Alphabet),  Cofounder Numenta Triply EE (BTech IIT-Mumbai, MS&PhD Stanford). #AGIComics blog.dileeplearning.com"
milesbrundage.bsky.social,"Miles Brundage",10,,2,"AI policy researcher, wife guy in training, fan of cute animals and sci-fi. Started a Substack recently: https://milesbrundage.substack.com/"
sleepinyourhat.bsky.social,"Sam Bowman",10,,2,"AI safety at Anthropic, on leave from a faculty job at NYU. Views not employers'. I think you should join Giving What We Can. cims.nyu.edu/~sbowman"
nickseaver.website,"Nick Seaver",11,,0,"anthropology, algorithms, attention | he/him | The conversation is characterized by Nick's use of language, but the content of the discussion remains unknown."
merbroussard.bsky.social,"Meredith Broussard, PhD",10,,2,"Critical AI, data journalism, literary nonfiction. Professor at NYU. Author, ""More Than a Glitch: Confronting Race, Gender, and Ability Bias in Tech."" meredithbroussard.com"
jennwv.bsky.social,"Jenn Wortman Vaughan",10,,2,"Sr. Principal Research Manager at Microsoft Research, NYC // Machine Learning, Responsible AI, Transparency, Intelligibility, Human-AI Interaction // WiML Co-founder // Former NeurIPS & current FAccT "
emilioferrara.bsky.social,"Emilio Ferrara",10,,2,"Prof of Computer Science at USC AI, social media, society, networks, data, and  HUMANS LABS http://www.emilio.ferrara.name"
kateclancy.bsky.social,"Kate Clancy",10,,2,"Feminist science professor at the University of Illinois. Obsessed with the uterus, even when it's being shitty. Author of PERIOD: The Real Story of Menstruation, now out on paperback. Up next: PREGNA"
pfrazee.com,"Paul Frazee",11,,0,"CTO at Bluesky. Not a nerd.  I'm on Germ DM 🔑 https://ger.mx/A6lLhakn-kJcja1Rlx6gOuwFvCEyrvK4y9lDSo6anFmU#did:plc:ragtjsm2j2vknwkz3zp4oxrd"
kris-inwood.bsky.social,"Kris Inwood",11,,0,"Economic historian w broad interests including population health, First Nations, mobility, inequality & lives of the incarcerated. Directing https://thecanadianpeoples.com & editing Asia-Pacific EcHR "
jamellebouie.net,"jamelle",11,,0,"The real jbouie. Columnist for the New York Times Opinion section. Co-host of the Unclear and Present Danger podcast. b-boy-bouiebaisse on TikTok. jbouienyt on Twitch. National program director of the"
ruha9.bsky.social,"Ruha Benjamin",11,,0,"✍🏽 • RACE AFTER TECHNOLOGY: Abolitionist Tools for the New Jim Code • VIRAL JUSTICE: How We Grow the World We Want • IMAGINATION: A Manifesto 📚www.ruhabenjamin.com"
rplevy.bsky.social,"Roger Levy",10,,2,"Director, MIT Computational Psycholinguistics Lab. President, Cognitive Science Society. Chair of the MIT Faculty. Open access & open science advocate. He.   Lab webpage: http://cpl.mit.edu/ Personal "
propublica.org,"ProPublica",11,,0,"Investigative journalism in the public interest. Headlines and (sometimes literal) receipts.  Send us tips: propublica.org/tips"
rezapour.bsky.social,"Shadi Rezapour",10,,1,"Assistant prof. of information science at Drexel CCI. computational social science, NLP for social good, narratives, stigma, #NLProc #NLP #NLP4SG Previously at UIUC, Spotify. she/her. shadirezapour.co"
ai2.bsky.social,"Ai2",10,,1,"Breakthrough AI to solve the world's biggest problems.  › Join us: http://allenai.org/careers › Get our newsletter: https://share.hsforms.com/1uJkWs5aDRHWhiky3aHooIg3ioxm"
shaynelongpre.bsky.social,"Shayne Longpre",10,,1,"PhD @ MIT. Prev: Google Deepmind, Apple, Stanford. 🇨🇦 Interests: AI/ML/NLP, Data-centric AI, transparency & societal impact"
bayesianboy.bsky.social,"Mel Andrews",9,,3,"I’m not like the other Bayesians. I’m different.   Thinks about philosophy of science, AI ethics, machine learning, models, & metascience. postdoc @ Princeton."
chrisbail.bsky.social,"Chris Bail",10,,1,"Duke Professor directing https://scai.duke.edu, https://sicss.io & https://polarizationlab.com. Author of Breaking the Social Media Prism."
emmaspiro.bsky.social,"Emma Spiro",9,,3,"Associate Professor at the UW iSchool, Co-Founder UW Center for an Informed Public | PhD in Sociology from UC Irvine | Research: social networks, sociology, information integrity & computational socia"
dfreelon.bsky.social,"Deen Freelon ",10,,1,"Allan Randall Freelon Sr. Prof. & Presidential Prof. of Communication @AnnenbergPenn. If you can't tell the difference between what's true and what you wish were true, take your business elsewhere."
davidlazer.bsky.social,"David Lazer",10,,1,"computational social scientist"
dggoldst.bsky.social,"Dan Goldstein",10,,1,"Partner Research Manager at Microsoft Research NYC. AI, Economics, Decision Science."
mpshanahan.bsky.social,"Murray Shanahan",9,,3,"Professor at Imperial College London and Principal Scientist at Google DeepMind. Posting in a personal capacity. To send me a message please use email."
gaelvaroquaux.bsky.social,"Gaël Varoquaux",9,,3,"Research & code: Research director @inria ►Data, Health, & Computer science ►Python coder, (co)founder of scikit-learn, joblib, & @probabl.bsky.social ►Sometimes does art photography  ►Physics PhD"
jessicahullman.bsky.social,"Jessica Hullman",10,,1,"Ginni Rometty Prof @NorthwesternCS | Fellow @NU_IPR | AI, people, uncertainty, beliefs, decisions, metascience | Blog @statmodeling"
shannonvallor.bsky.social,"Shannon Vallor",10,,1,"Philosopher/AI Ethicist at Univ of Edinburgh, co-Director @technomoralfutures.bsky.social and BRAID @braiduk.bsky.social, author of Technology and the Virtues (2016) and The AI Mirror (2024). Views my"
dbamman.bsky.social,"David Bamman",10,,1,"Associate Professor, School of Information, UC Berkeley. NLP, computational social science, digital humanities. "
sebastianraschka.com,"Sebastian Raschka (rasbt)",9,,3,"ML/AI researcher & former stats professor turned LLM research engineer. Author of ""Build a Large Language Model From Scratch"" (https://amzn.to/4fqvn0D) & reasoning (https://mng.bz/Nwr7).  Also bloggin"
garymarcus.bsky.social,"Gary Marcus",10,,1,"AI and cognitive science, Founder and CEO (Geometric Intelligence, acquired by Uber). 8 books including Guitar Zero, Rebooting AI and Taming Silicon Valley.  Newsletter (50k subscribers): garymarcus.s"
nic221.bsky.social,"Nicole Hennig",10,,1,"E-learning dev & AI educator at U of Arizona Libraries. Former head of UX at MIT Libraries. Winner of MIT Excellence Award. nicolehennig.com. Digital nomad from 2013-17, locationflexiblelife.com. - ve"
datasociety.bsky.social,"Data & Society",10,,1,"Data & Society is a nonprofit research institute that studies the social implications of data-centric technologies, automation, and AI."
ubiquity75.xyz,"Sarah T Roberts, PhD",9,,3,"Professor, researcher, author.  Prez, Assoc of Internet Researchers (AOIR), synth lover, fan of many things, gay lady.  Wrote a book called Behind the Screen: Content Moderation in the Shadows of Soci"
ruchowdh.bsky.social,"Rumman Chowdhury",10,,1,"www.rummanchowdhury.com www.humane-intelligence.org   CEO & co-founder, Humane Intelligence US Science Envoy for AI (Biden Administration)"
