handle,displayName,followedByCount,orcid_to_verify,academicScore,bio
dustinbwright.com,"Dustin Wright",7,,3,"Postdoc  @ University of Copenhagen (CopeNLU) | Making the world's knowledge reliable and accessible w/ ML + NLP | Former UMSI, AI2, IBM Research, UCSD | https://dustinbwright.com"
myra.bsky.social,"Myra Cheng",8,,1,"PhD candidate @ Stanford NLP https://myracheng.github.io/"
t-shoemaker.bsky.social,"Tyler Shoemaker",8,,1,"Assistant Professor, Critical AI  tylershoemaker.info"
loriemerson.net,"Lori Emerson",8,,1,"media studies professor | Other Networks: A Radical Technology Sourcebook (Anthology Editions, May 2025) | dir. @mediaarchaeology.bsky.social | http://loriemerson.net | Boulder, Colorado | 🇨🇦 🇺🇲 �"
davekarpf.bsky.social,"Dave Karpf",8,,1,"Political Communication Professor at GWU. I write a lot about the history and future of tech and politics. Best known for that one time I made fun of Bret Stephens.   Davekarpf.substack.com"
elikaortega.bsky.social,"Élika Ortega",8,,1,"Assist. Prof. of Spanish Book: Binding Media. Hybrid, Print-Digital Lit from across the Americas (SUP 2025) Dog person. Rose person.  Mexican in the US. Posts in Spanglish https://elikaortega.net"
jessyjli.bsky.social,"Jessy Li",8,,1,"https://jessyli.com Associate Professor, UT Austin Linguistics.   Part of UT Computational Linguistics https://sites.utexas.edu/compling/ and UT NLP https://www.nlp.utexas.edu/"
tinalaw.bsky.social,"Tina Law",7,,3,"assistant professor of sociology @ ucdavis | northwestern phd | race, inequality, democracy, cities, AI, computational methodology  https://tina-law.github.io/"
lollardfish.bsky.social,"David M. Perry",8,,1,"Journalist & historian. Pub musician. Dad. Husband. Fishing obsessed. I also do dishes. Preorder: #ThePublicScholar - https://tinyurl.com/thepublicscholar. Subscribe to the Modern Medieval Newsletter:"
alexhanna.bsky.social,"Alex Hanna",8,,1,"Director of Research, @dairinstitute.bsky.social Roller derby athlete https://alex-hanna.com Book: thecon.ai Pod+newsletter: https://dair-institute.org/maiht3k 🇪🇬ⲙⲉⲧⲣⲉⲙⲛ̀ⲭⲏⲙⲓ 🏳️‍⚧️ she/هي 📸 @willt"
skychwang.bsky.social,"Sky CH-Wang",8,,1,"CS PhD candidate at Columbia. NLP & Computational Social Science. NSF GRFP fellow. he/him. https://skywang.me"
alanyliu.bsky.social,"Alan Liu",8,,1,"I'm a professor in digital humanities & English at UC Santa Barbara. For  public humanities, I founded http://4Humanities.org & co-founded https://center-humanities-communication.org/. My website: htt"
brendannyhan.bsky.social,"Brendan Nyhan",8,,1,"Dartmouth political scientist and Bright Line Watch co-director. Previously Upshot NYT / CJR contributor, Spinsanity co-founder, All the President's Spin co-author.  https://sites.dartmouth.edu/nyhan/"
hoytlong.bsky.social,"Hoyt Long",7,,3,"Scholar of Japanese literature, media, cultural analytics. Now working on platforms, television, cultural AI. ""The Values in Numbers"" (2021). Offline: cooking, ceramics, watercolor. Professor at Unive"
annejonas.bsky.social,"Anne Jonas 🌻",8,,1,"Assistant Professor @ UM-Flint CIT. Studying digital technologies, schools, community, and power through qualitative and design-based research methods. Previously at MSU, UC Berkeley, Barnard, and Bro"
nmw.bsky.social,"Nic Weber",8,,1,"Associate Professor @ UW  Computational Social Science"
mims.bsky.social,"Christopher Mims",8,,0,"WSJ tech columnist. Dog person. Author of How to AI, a no-nonsense, bullshit-free guide to how to get actual utility from AI, aimed at the skeptics who are tired of the hype surrounding it."
groceryheist.cc,"Nate TeBlunthuis",7,,2,"https://tebluntuhis.cc   Assistant Professor at the University of Texas at Austin in the School of Information. Computational social science, peer production, social computing, HCI."
byron.bsky.social,"Byron Wallace",7,,2,"Assoc. Prof in CS @ Northeastern, NLP/ML & health & etc. He/him."
brettbobley.bsky.social,"Brett Bobley",8,,0,"Working as an advisor to Schmidt Sciences for their HAVI DH program (AI + Humanities/cultural heritage). Former CIO for the NEH & founder of the Office of Digital Humanities."
colmweb.org,"Conference on Language Modeling",8,,0,"The 2025 Conference on Language Modeling will take place at the Palais des Congrès in Montreal, Canada from October 7-10, 2025"
benjaminjriley.bsky.social,"Benjamin Riley",8,,0,"Founder of Cognitive Resonance, a new venture dedicated to helping people understand human cognition and generative AI. Advocate for humans.  Newsletter: https://buildcognitiveresonance.substack.com/"
catblanketflower.yuwakisa.com,"Singularity's Bounty e/🇺🇦",8,,0,"Feeding the basilisk  Large Language Models are a cornucopia for the curious  I do computer stuff but that doesn't define me  posts are not financial advice  stuff I've made at yuwakisa.com"
joestacey.bsky.social,"Joe Stacey",6,,4,"NLP PhD student at Imperial College London and Apple AI/ML Scholar."
anneo.bsky.social,"Anne Oeldorf-Hirsch",7,,2,"Comm tech & social media research professor by day, symphony violinist by night, outside as much as possible otherwise. German/American Pacific Northwestern New Englander, #firstgen academic, she/her,"
annamillsoer.bsky.social,"Anna Mills",7,,2,"Writer, community college writing teacher, obsessed with AI in education, #OER advocate, author of HowArgumentsWork.org.  annarmills.com "
akshitab.bsky.social,"Akshita Bhagia",8,,0,"Research Engineer at Ai2 https://akshitab.github.io/ "
ekazakos.bsky.social,"Evangelos Kazakos",5,,6,"Postdoctoral researcher @ CIIRC, CTU, Prague working in vision & language. Also robotics noob. PhD from University of Bristol. Ex. Samsung Research (SAIC-C). I love coffee and plants. And socks."
xjdr.bsky.social,"xjdr",8,,0,"hot takes, linear Algebra, JAX apologist, Raconteur"
djfoster.bsky.social,"Dylan Foster 🐢",7,,2,"Principal Researcher in AI/ML/RL Theory @ Microsoft Research NE/NYC. Previously @ MIT, Cornell. http://dylanfoster.net   RL Theory Lecture Notes: https://arxiv.org/abs/2312.16730"
natashajaques.bsky.social,"Natasha Jaques",6,,4,"Assistant Professor at UW and Staff Research Scientist at Google DeepMind. Social Reinforcement Learning in multi-agent and human-AI interactions. PhD from MIT. Check out https://socialrl.cs.washingto"
abursuc.bsky.social,"Andrei Bursuc",6,,4,"Research Scientist at valeo.ai  | Teaching at Polytechnique, ENS  | Alumni at Mines Paris, Inria, ENS | AI for Autonomous Driving, Computer Vision, Machine Learning | Robotics amateur ⚲ Paris, France "
yisongyue.bsky.social,"Yisong Yue",7,,2,"AI professor at Caltech.  General Chair ICLR 2025.  http://www.yisongyue.com"
handle.invalid,"Tim Rocktäschel",6,,4,"Director and Open-Endedness Team Lead Google DeepMind (GDM). Professor of Artificial Intelligence, University College London (UCL), and PI of @ucldark.com. Fellow, European Laboratory for Learning and"
smerity.bsky.social,"Smerity",7,,2,"Always pondering startups, ML, Rust, Python, and 3D printing. Independent ML researcher consulting on LMs + data. Previously: Salesforce Research, MetaMind, CommonCrawl, Harvard. 🇦🇺 in SF. He/him. P"
avehtari.bsky.social,"Aki Vehtari",7,,2,"Professor in computational Bayesian modeling at Aalto University, Finland. Bayesian Data Analysis 3rd ed, Regression and Other Stories, and Active Statistics co-author. #mcmc_stan and #arviz developer"
jurgenpfeffer.bsky.social,"Jürgen Pfeffer",7,,2,"Prof of Computational Social Science. SOT/TU Munich. Critical Data Studies, AI & Democracy, #CSS @ICWSM"
domoritz.de,"Dominik Moritz",7,,2,"Visualization, data, AI/ML. Professor at CMU (@dig.cmu.edu, @hcii.cmu.edu) and researcher at Apple. Also sailboats ⛵️ and chocolate 🍫.  www.domoritz.de"
andrew.heiss.phd,"Andrew Heiss",7,,2,"Assistant professor at Georgia State University, formerly at BYU. 6 kids. Study NGOs, human rights, #PublicPolicy, #Nonprofits, #Dataviz, #CausalInference.   #rstats forever.  andrewheiss.com  Signal:"
rmcelreath.bsky.social,"Richard McElreath 🐈‍⬛",8,,0,"Anthropologist - Bayesian modeling - science reform - cat and cooking content too - Director @ MPI for evolutionary anthropology https://www.eva.mpg.de/ecology/staff/richard-mcelreath/"
merve.bsky.social,"merve",8,,0,"proud mediterrenean 🧿 open-sourceress at hugging face 🤗 multimodality, zero-shot vision, vision language models, transformers"
akhilrao.bsky.social,"grand theft eigenvalue 🔆",8,,0,"personal account  he/him"
ronentk.me,"Ronen Tamari",7,,2,"Researcher & entrepreneur | Co-founder @cosmik.network | Building https://semble.so/ | collective sensemaking | https://ronentk.me/ | Ecosystem building @atproto.science | Prev- Open Science Fellow @a"
catherinebreslin.bsky.social,"Catherine Breslin ",7,,2,"AI scientist & consultant :: prev Amazon Alexa, Toshiba, Cam Uni :: voice & language tech :: powered by coffee :: photographer :: Cambridge UK   https://www.catherinebreslin.co.uk"
deliprao.bsky.social,"Delip Rao",8,,0,"Building. Affiliations: @JHU, @Penn, @UCSC, @Amazon, @Twitter || Art: #NLProc, Vision, Speech, #DeepLearning || Life: 道元, improv, running 🌈"
kordinglab.bsky.social,"Konrad Kording",8,,0,"@Penn Prof, deep learning, brains, #causality, rigor, http://neuromatch.io, Transdisciplinary optimist, Dad, Loves outdoors, 🦖 , c4r.io"
mraginsky.bsky.social,"Maxim Raginsky",8,,0,"web: http://maxim.ece.illinois.edu substack: https://realizable.substack.com"
oms279.bsky.social,"Oscar Stuhler",7,,2,"Assistant Professor of Sociology at Northwestern Culture, political sociology, NLP, social networks, computational social science oscarstuhler.org"
harmankaur.bsky.social,"Harmanpreet Kaur",7,,2,"Assistant professor at University of Minnesota CS. Human-centered AI, interpretable ML, hybrid intelligence systems."
hopeschroeder.bsky.social,"Hope Schroeder",7,,2,"Studying NLP, CSS, and Human-AI interaction. PhD student @MIT. Previously at Microsoft FATE + CSS, Oxford Internet Institute, Stanford Symbolic Systems hopeschroeder.com"
kaitlynzhou.bsky.social,"Kaitlyn Zhou",7,,2,"Incoming Assistant Professor @cornellbowers.bsky.social Researcher @togetherai.bsky.social Previously @stanfordnlp.bsky.social @ai2.bsky.social @msftresearch.bsky.social  https://katezhou.github.io/"
robyncaplan.bsky.social,"Robyn Caplan",7,,2,"Assistant professor at Duke University. Tech policy, platform governance, mom.  I make bad jokes sometimes."
estellesmithphd.bsky.social,"Estelle Smith",7,,2,"Assistant Professor, CS, Colorado School of Mines. Online spiritual care, social computing, online governance, Human-AI Interaction: http://bit.ly/sacredtech. CSCW, CHI, TOCHI, etc. 👩🏼‍💻 Community "
aaronshaw.bsky.social,"Aaron Shaw",7,,2,"Usually professoring, parenting, running, etc. Social science and design of digital public goods in online communities. Northwestern University, Chicagoland. https://communitydata.science"
rnv.bsky.social,"Arnav Arora",6,,4,"PhD student, University of Copenhagen NLP, misinformation, media framing, hatespeech, cultural values, CSS, Pol Comm, AI ethics | he/him. https://scholar.google.com/citations?user=EQUUUUoAAAAJ&hl=en"
sandeepsoni.bsky.social,"Sandeep Soni",7,,2,"Assistant Professor @ Emory University "
seanjtaylor.com,"Sean J Taylor",7,,2,"Data Science, Causal Inference, Economics, Statistics and Machine Learning  Two joys in life: [1] Learning something interesting about the world [2] Telling people about it  Data Science @OpenAI"
peck.phd,"Evan Peck",7,,2,"🦬🏔️ @cuboulder.info science prof  Vis / HCI - Designing data for the public.  📊❤️ PI @informationvisions.bsky.social   Previously: Bucknell CS prof, Tufts CS PhD 🔗 https://peck.phd/"
rebeccasolnit.bsky.social,"Rebecca Solnit",8,,0,"Raised on Coast Miwok land, longtime resident on Ramaytush Ohlone land, writer, climate person, feminist, wanderer. Just started a newsletter at MeditationsInAnEmergency.com. "
dynarski.bsky.social,"Prof Dynarski",7,,2,"Economist & Prof at Harvard | 1st-gen college grad | Education, inequality | Shitposts are in a Boston accent | Former union organizer | Native Somervillen  NYT Columns https://bit.ly/3TbaxXV  https:/"
laylab.bsky.social,"Layla Bouzoubaa",7,,2,"PhD Candidate @ Drexel University, Info. Sci. 🇲🇦 Studying lived experiences of people who use #drugs, #stigma, #harmreduction through mixed methods, #NLProc. Public health background. Aspiring wine "
brenocon.bsky.social,"brendan o’connor",8,,0,"natural language processing, social science, umass, western mass http://brenocon.com he/him"
robvoigt.bsky.social,"Rob Voigt",7,,2,"using computational methods to understand the linguistic mechanisms of social problems | NLP, socioling, discourse-pragmatics | asst prof at UC Davis Linguistics  https://robvoigt.faculty.ucdavis.edu/"
suhr.bsky.social,"suhr",8,,0,"pedestrian and straphanger"
shugars.bsky.social,"Sarah Shugars",7,,2,"Assistant Professor of Communication @ Rutgers University. Computational social science, political communication, civic studies. First gen. They/them"
archive.org,"Internet Archive",8,,0,"Internet Archive is a non-profit research library preserving web pages, books, movies & audio for public access. Explore web history via the Wayback Machine. "
dril.bsky.social,"wint",8,,0,"Never Bullshit I challenge any and every one who wants to kick my ass to a debate .  https://www.patreon.com/dril https://www.instagram.com/dril  https://linktr.ee/drilreal"
jeddobson.bsky.social,"James E. Dobson",7,,2,"Associate Professor of English and Creative Writing at Dartmouth College. Author of The Birth of Computer Vision (Minnesota), Critical Digital Humanities (Illinois), and co-author of Moonbit (punctum)"
joguldi.bsky.social,"Jo Guldi",7,,2,"Professor of Quantitative Methods at Emory. Data scientist, writer, historian. Newest: The Long Land War (2022), The Dangerous Art of Text Mining (2023). "
mnlee.bsky.social,"Mina Lee",7,,2,"Assistant Professor @ UChicago CS/DSI (NLP & HCI) | Writing with AI ✍️  https://minalee-research.github.io/"
hakeemjefferson.bsky.social,"Hakeem Jefferson",7,,2,"Assistant professor of political science. I think about identity, stigma, race, and politics more than any normal person should. Lover of life. Pro-democracy.  People should dance more.  Not Hakeem Je"
timfduffy.com,"Tim Duffy",7,,1,"I like utilitarianism, consciousness, AI, EA, space, kindness, liberalism, longtermism, progressive rock, economics, and most people. Substack: http://timfduffy.substack.com"
zehavoc.bsky.social,"Djamé 🟥",7,,1,"Associate professor in NLP, engaged citizen. Tweeting about work, life and stuffs that I care about. All my tweets can be used freely. @zehavoc@mastodon.social @zehavoc (@twitter)"
sarah-nlp.bsky.social,"Sarah Wiegreffe",7,,1,"Research in NLP (mostly LM interpretability & explainability). Assistant prof at UMD CS + CLIP. Previously @ai2.bsky.social @uwnlp.bsky.social Views my own. sarahwie.github.io"
bvlsingler.bsky.social,"Prof. Dr Beth Singler",6,,3,"Anthropologist/Geek thinking about how you think about AI & robots. Assistant Professor in Digital Religions at UZH. Bvlsingler.com. She/her. 🌈 https://www.taylorfrancis.com/books/oa-mono/10.4324/978"
brennan.computer,"brennan",7,,1,"unlicensed back alley alchemy  digital ⇄ physical, 3D and AI research. living in a world of magic and vibrance"
marvin-schmitt.com,"Marvin Schmitt",6,,3,"⛵️ Research Resident @ Midjourney 🇪🇺 Member @ellis.eu 🤖 Generative NNs, Deep Learning, ProbML, Simulation Intelligence 🎓 PhD+MSc Computer Science, MSc Psychology 🏡 https://marvin-schmitt.com"
scobleizer.bsky.social,"Robert Scoble",7,,1,"Advocate for tech that makes humans better | Spatial Computing, Holodeck, and AI Futurist | Ex-Microsoft, Rackspace | Co-author, ""The Infinite Retina."""
sutawika.com,"Lintang Sutawika",7,,1,"PhD @ltiatcmu.bsky.social previously @eleutherai.bsky.social  🌐 lintang.sutawika.com"
valentinhofmann.bsky.social,"Valentin Hofmann",7,,1,"Postdoc @ai2.bsky.social & @uwnlp.bsky.social"
jbhuang0604.bsky.social,"Jia-Bin Huang",7,,1,"Associate Professor at UMD CS. YouTube: https://youtube.com/@jbhuang0604  Interested in how computers can learn and see."
yoshitomo-matsubara.net,"Yoshitomo Matsubara",5,,5,"Research Scientist at Yahoo! / ML OSS developer PhD in Computer Science at UC Irvine Research: ML, NLP, Computer Vision, Information Retrieval Technical Chair: ECCV'26 CVPR'26 WACV'26  ICCV'25 Open So"
cgpotts.bsky.social,"Chris Potts",6,,3,"Stanford Professor of Linguistics and, by courtesy, of Computer Science, and member of @stanfordnlp.bsky.social and The Stanford AI Lab. He/Him/His. https://web.stanford.edu/~cgpotts/"
yann-lecun.bsky.social,"Yann LeCun",5,,5,"Professor a NYU; Chief AI Scientist at Meta. Researcher in AI, Machine Learning, Robotics, etc. ACM Turing Award Laureate.  http://yann.lecun.com"
gusthema.bsky.social,"Gus",7,,1,"Gemma Product Manager @google DeepMind  - Gemma 💎 - Google AI ⚙️🧠"
alisongopnik.bsky.social,"Alison Gopnik",7,,1,"Cognitive scientist, philosopher, and psychologist at Berkeley, author of The Scientist in the Crib, The Philosophical Baby and The Gardener and the Carpenter and grandmother of six."
mmosleh.bsky.social,"Mohsen Mosleh",7,,1,"Prof @Oxford, Affiliate @MIT #SocialMedia #Misinformation #Polarization www.MohsenMosleh.com"
karen-ullrich.bsky.social,"Karen Ullrich (s/h) ✈️ Neurips",6,,3,"Research scientist at FAIR NY ❤️ LLMs + Information Theory. Previously, PhD at UoAmsterdam, intern at DeepMind + MSRC."
marckeuschnigg.bsky.social,"Marc Keuschnigg",6,,3,"Professor of Sociology, Leipzig U The Institute of Analytical Sociology, Linköping U Studying cultural dynamics, inequality, norms www.keuschnigg.org"
eckles.bsky.social,"Dean Eckles",7,,1,"networks, contagion, causality faculty at MIT"
zouharvi.bsky.social,"Vilém Zouhar #EMNLP",7,,1,"PhD student @ ETH Zürich | all aspects of NLP but mostly evaluation and MT | go vegan | https://vilda.net"
inesmontani.bsky.social,"Ines Montani 〰️",7,,1,"💥 Founder & CEO @explosion.ai 👩‍💻 Developing spacy.io & prodi.gy 🐍 Python Software Foundation Fellow ⚡ Hacking @feministai.party 🧠 AI, Machine Learning & NLP  💼 linkedin.com/in/inesmontani 🐘 si"
tsawallis.bsky.social,"Tom Wallis",6,,3,"Vision scientist. Professor at the Centre for Cognitive Science, Technical University of Darmstadt, Germany. 🇦🇺🇩🇪. pronoun.is/he  https://www.psychologie.tu-darmstadt.de/perception"
chriswolfvision.bsky.social,"Christian Wolf",6,,3,"Principal Scientist at Naver Labs Europe, Lead of Spatial AI team. AI for Robotics, Computer Vision, Machine Learning. Austrian in France. https://chriswolfvision.github.io/www/"
gershbrain.bsky.social,"Sam Gershman",6,,3,"Professor, Department of Psychology and Center for Brain Science, Harvard University https://gershmanlab.com/"
bengolub.bsky.social,"Ben Golub",6,,3,"economics and computer science professor at Northwestern  bengolub.net  social and economic networks  originally from Ukraine"
neurograce.bsky.social,"Grace Lindsay",6,,3,"Asst Professor Psychology & Data Science @ NYU | Working on brains & climate, separately | Author of Models of the Mind: How physics, engineering, and mathematics have shaped our understanding of the "
adverb.bsky.social,"Adverb",7,,1,"ML, Psychology, Art, Materials Informatics, Espresso, &c.  he/him"
twkillian.bsky.social,"Taylor W. Killian",6,,3,"Senior Research Scientist @MBZUAI. Focused on decision making under uncertainty, guided by practical problems in healthcare, reasoning, and biology."
tressiemcphd.bsky.social,"Tressie McMillan Cottom",7,,1,"Professor. Sociologist. NYTimes Opinion Columnist. Books: THICK, LowerEd. Forthcoming: 1)Black Mothering & Daughtering and 2)Mama Bears.   Beliefs: C.R.E.A.M. + the internet ruined everything good + b"
beccalew.bsky.social,"Becca Lewis",7,,1,"Assistant prof of comparative media studies @MIT, researching the rise of right-wing politics in Silicon Valley and online. Email me at beccalewis@protonmail.com. Read my stuff at www.beccalew.org."
anubrata.bsky.social,"Anubrata Das @ NAACL 2025",7,,1,"Just Finished PhD @ UT Austin; Human-Centered NLP. Language Models  https://anubrata.github.io"
nilou.bsky.social,"Nilou Salehi",7,,1,"hci+ai co-founder/co-ceo @Across AI prof  @UC Berkeley  gif whisperer | 🐱🐱 mom  👩🏻‍🏫 niloufar.org 👩🏻‍💻 across.ai | https://bsky.app/profile/across-ai.bsky.social"
brookeerinduffy.bsky.social,"Brooke Erin Duffy",6,,3,"social media researcher and author associate professor at Cornell University platforms, power, and the creator economy  www.brookeduffy.com"
karger.bsky.social,"David Karger",7,,1,"Professor, MIT EECS/CSAIL http://people.csail.mit.edu/karger"
naz-andalibi.bsky.social,"Nazanin Andalibi",7,,1,"Associate Prof, University of Michigan School of Information | she/her | emotion AI/privacy/justice/reproductive health and justice/endometriosis/social media| 🐕‍🦺mom | posts don’t represent employe"
haimson.bsky.social,"Oliver Haimson",7,,1,"Associate Professor at UM School of Information researching social computing, HCI, designing trans tech, social media, identity transitions, content moderation. 🏳️‍⚧️ he/him"
bostonjoan.bsky.social,"BostonJoan 🏳️‍🌈 🦫",6,,3,"I am the founder of The Critical Internet Studies Institute and an Assistant Professor of Journalism and Emerging Media Studies at Boston University  www.criticalinternet.org"
ingmarweber.de,"Ingmar Weber",6,,3,"Alexander von Humboldt Professor for AI and Chair for Societal Computing at Saarland University. Co-Director at https://i2sc.net."
dippedrusk.com,"Vagrant Gautam",7,,1,"I do research on trustworthy NLP, i.e., social + technical aspects of fairness, reasoning, etc.  pronouns: xe/they (Deutsch: keine) nouns: computer scientist, linguist, birder adjectives: trans, queer"
stevewilson.bsky.social,"Steve Wilson",7,,1,"assistant prof at umich-flint nlp and computational social science steverw.com"
aylincaliskan.bsky.social,"Aylin Kamelia Caliskan",5,,5,"https://faculty.washington.edu/aylin  Computer scientist • Prof @UWischool & @UWcse Co-Director @TechPolicyLab • Nonresident Senior Fellow @BrookingsInst AI & Societal Impacts: Ethics in NLP • Multimo"
rockberta.bsky.social,"roberta rocca",6,,3,"assistant professor @ interacting minds centre, aarhus university 🇩🇰  || nlp, cognition, datasci 🗣️ 🧠 🤖 || previously: postdoc @ UT Austin 🤘 & data fellow @ UN humdata 🇺🇳"
davelevitan.bsky.social,"Dave Levitan",7,,1,"Science journalist, bylines all over the place. Book: NOT A SCIENTIST: How politicians mistake, misrepresent, and utterly mangle science (WW Norton). Signal: @davelevitan.26 www.davelevitan.com Sign u"
astrokatie.com,"Katie Mack",7,,1,"Cosmologist, pilot, author, connoisseur of cosmic catastrophes. TEDFellow, CIFAR Azrieli Global Scholar. Domain verified through my personal astrokatie.com website. She/her. Dr.  Personal account; not"
shaily99.bsky.social,"Shaily",7,,1,"PhDing at LTI, CMU Prev: Ai2, Google Research, MSR  Evaluating language technologies, regularly ranting, and probably procrastinating.  https://sites.google.com/view/shailybhatt/"
anjalief.bsky.social,"Anjalie Field",6,,3,"Faculty at Johns Hopkins University in Computer Science Working on NLP and computational social science"
rmmhicke.bsky.social,"Rebecca Hicke",6,,3,"PhD Student in CS @ Cornell University Working on applying ML techniques to digital humanities questions"
mattf.nl,"Matthew Finlayson",7,,1,"NLP PhD @ USC Previously at AI2, Harvard mattf1n.github.io"
pamelasamuelson.bsky.social,"Pamela Samuelson",7,,1,"Professor, Berkeley Law School, who writes about challenges that new information technologies pose for intellectual property & other laws. Past Chair & member of Electronic Frontier Foundation Board &"
eegilbert.org,"Eric Gilbert",7,,1,"Professor at Michigan. On sabbatical at the Berkman Klein Center. http://eegilbert.org"
conradhackett.bsky.social,"Conrad Hackett",7,,1,"Demography nerd at Pew Research Center Global religious change, sociology"
jamesosullivan.bsky.social,"James O’Sullivan",5,,5,"Teaching & Learning Policy Advisor for Artificial Intelligence at the Higher Education Authority (HEA); Senior Lecturer at University College Cork (UCC); Lead Researcher on CASCADE (Horizon Europe MSC"
glennroe.bsky.social,"Glenn Roe",6,,3,"Professor of Digital Scholarship & French Literature, University of Oxford; Co-director of the Voltaire Lab."
kmcdono.bsky.social,"Katie McDonough",7,,1,"History + DH @ Lancaster University. MapReader, computational history, history of infrastructure and information. Writing a book about people & highways in 18th c. France."
emtseng.bsky.social,"Emily Tseng",6,,3,"Postdoc at MSR, soon a prof at UW HCDE, got my PhD at Cornell IS. I think about power, privacy, and participation in HCI, security and AI."
dan-sinnamon.bsky.social,"Dan Sinykin",7,,1,"former 2x pie-eating champion of St Olaf College"
cliu.bsky.social,"Chuncheng Liu",6,,3,"Sociologist interested in STS, data, and the state. Assistant Professor of Communication and Sociology at Northeastern University. chunchengliu.com"
karengregory.bsky.social,"Karen Gregory",7,,1,"Soc of Work + Platform Labor | U of Edinburgh | Created MSc Digital Sociology | @jcultecon + Platforms & Society | CAHSS Digital Lead | Critical Data Studies @ EFI  Writing: Enchanted Entrepreneurs: M"
stellali.bsky.social,"Stella Li",6,,2,"PhD student @uwnlp.bsky.social @uwcse.bsky.social | visiting researcher @MetaAI | previously @jhuclsp.bsky.social  https://stellalisy.com"
dominsta.bsky.social,"Dominik Stammbach",6,,2,"Postdoc @ Princeton University, Natural Language Processing"
keytryer.net,"Key 🗝 🦊✅",7,,0,"He/him. Fox gamedev irl. Machine pervert. Furry stuff here and opinions about technology, games, movies, AI, VR. Pfp + Banner 🎨 by @Perpleon.bsky.social  https://vrchat.com/home/user/usr_d9ee62da-234"
